Category;Words
A;процентных платежей, чистых процентных, долговой нагрузки, являются надлежащими, рамках анализа, корпоративного управления, нефинансовым компаниям, принимало участие, присвоения нефинансовым, платежей налогов, качество достоверность, достоверность мнению
AA;процентных платежей, долговой нагрузки, чистых процентных, являются надлежащими, фиксированных платежей, рамках анализа, платежей налогов, нефинансовым компаниям, присвоения нефинансовым, корпоративного управления, принимало участие, качество достоверность, достоверность мнению, оказывало дополнительных, прогноза ожидается, действию привести, высоком уровне, погашения эмиссии, высокий уровень
AAA;погашения эмиссии, являются надлежащими, процентных платежей, долговой нагрузки, рамках анализа, стороны государства, нефинансовым компаниям, принимало участие, присвоения нефинансовым, поддержки стороны, качество достоверность, достоверность мнению, прогноза ожидается, оказывало дополнительных, чистых процентных, денежных средств, компании уровне, финансовых обязательств, процентные неконвертируемые
B;долговой нагрузки, рамках анализа, корпоративного управления, являются надлежащими, нефинансовым компаниям, присвоения нефинансовым, прогноза ожидается, процентных платежей, оценивается агентством, денежного потока, является официальный, оказывало дополнительных, компании уровне, действующим законодательством, негативное влияние, управления рисками, принимало участие, влияние уровень, чистой прибыли
BB;процентных платежей, долговой нагрузки, чистых процентных, корпоративного управления, являются надлежащими, рамках анализа, нефинансовым компаниям, прогноза ожидается, принимало участие, оказывало дополнительных, присвоения нефинансовым, денежного потока, оценивается агентством, качество достоверность, достоверность мнению, платежей налогов, влияние оценку, процентным платежам, настоящего прессрелиза
BBB;процентных платежей, чистых процентных, долговой нагрузки, являются надлежащими, корпоративного управления, нефинансовым компаниям, присвоения нефинансовым, оказывало дополнительных, процентным платежам, прогноза ожидается, принимало участие, рамках анализа, платежей налогов, действию привести, качество достоверность, достоверность мнению, денежного потока, настоящего прессрелиза, процессе присвоения
C;являются надлежащими, состоянии дефолта, неисполненного обязательства, неисполнением обязательств, рамках анализа, финансовых обязательств, компании уровня, впервые опубликован, данному объекту, объекту опубликован, опубликован присвоен, является долгосрочным, долгосрочным прогноза, прогноза ожидается, ожидается позднее, присвоения последнего
